school_name,url_address,address,postal_code,telephone_no,telephone_no_2,fax_no,fax_no_2,email_address,mrt_desc,bus_desc,principal_name,first_vp_name,second_vp_name,third_vp_name,fourth_vp_name,fifth_vp_name,visionstatement_desc,missionstatement_desc,philosophy_culture_ethos,dgp_code,zone_code,cluster_code,type_code,nature_code,session_code,mainlevel_code,sap_ind,autonomous_ind,gifted_ind,ip_ind,mothertongue1_code,mothertongue2_code,mothertongue3_code,special_sdp_offered
NATIONAL JUNIOR COLLEGE,www.nationaljc.moe.edu.sg,37 HILLCREST ROAD,288913,64661144,na,64684535,na,NJC@MOE.EDU.SG,"BOTANIC GARDENS MRT, TAN KAH KEE MRT, SIXTH AVENUE MRT","151, 154, 156, 157, 170, 170X, 171, 174, 66, 67, 67A, 67W, 74, 852, 961, 961C",MR ANG POW CHEW,MR LIONG HUAI YU,MR LIM WEE JAMES,MR ZAINAL ABIDIN BIN MAHMOOD,na,na,NJCian's demonstrate Loyalty with Integrity; Scholarship with Creativity; Leadership with Sensitivity,College of the Nation: Home of Scholars and Leaders who Serve with Honour,"We seek to create a joyful and lively learning community for students and staff. Every NJCian will leave with a distinctive and memorable experience. They will learn to serve with honour, to be loyal to family and Singapore, to be leaders sensitive to the needs of others, and to be creative in their approach to solving problems. They would have imbibed the values of civility, altruism, resilience and enterprise.",BUKIT TIMAH,SOUTH,SOUTH 3,GOVERNMENT SCHOOL,CO-ED SCHOOL,FULL DAY,MIXED LEVEL,No,No,No,Yes,Chinese,Malay,Tamil,"For the Integrated Programme (Junior High), we offer Language Arts (English & Literature), Chemistry, Physics, Biology, Governance & Society, Mathematics (both E and A Maths), History, Geography, Higher Mother Tongue and Mother Tongue for the first 4 years, as well as Integrated Sciences, Thinking, and General Arts Programme (Art and Music) for the first 2 years. Advanced Language Arts, Advanced Humanities and Man & Ideas are also offered to capable students at JH3 & JH4. The College offers a wide range of special programmes in various domains. They are: SPIRE (Special Programme in Inquiry and Research), Research@NJC, Accelerated Mathematics, Advanced Sciences, Art Elective Programme (AEP), NJC Music Programme, Enhanced Boarding Programme, Cultural Mapping-On-The-Move, Leadership,  Values In Action and Guidance Programmes, Humanities Scholarship Programme, Sapphire Scholars Programme and International Programmes.  Students may also offer a Third Language outside of College. Junior High 1 students undergo a special CCA programme known as CAFE. CCAs offered for Junior High are basketball, canoeing, shooting, softball, squash, track and field, Chinese orchestra, Chinese dance, choir, guitar ensemble, Indian dance, Malay dance, string orchestra, symphonic band and Western dance. Students may also join any CCA under the Talent Management Scheme.  Note that H1, H2 and H3 subjects listed are only offered at Senior High (JC years)."
TEMASEK JUNIOR COLLEGE,http://temasekjc.moe.edu.sg/,22 BEDOK SOUTH ROAD,469278,64428066,na,64428762,na,TEMASEK_JC@MOE.EDU.SG,BEDOK MRT,"12, 16, 31, 38, 47, 196, 197, 229",MDM SIM AY NAR,MDM TAN KIA HUAN,MR FOO JUNG HIN SIMON,MR MARK CHAN,na,na,"An Institute of Distinction, A Dynamic Learning Culture,  A Caring TJC Family","Broaden Minds, Touch Hearts, Enrich Lives","Set in sprawling grounds recalling a gracious time past, at TJC our feet are firmly planted on the ground but our arms stretch to the sky. Every TJCian is nurtured to be a trailblazer with a heart for we believe that with sound values, we can steer steadfastly and stay true to our course. Mindful of tradition, roused by imagination and fuelled by ambition, TJCians strive to be active learners, caring and committed citizens and ethical leaders. Our motto we proudly serve is, For College, For Nation.",BEDOK,EAST,EAST 2,GOVERNMENT SCHOOL,CO-ED SCHOOL,FULL DAY,MIXED LEVEL,No,No,No,Yes,Chinese,Malay,Tamil,"The Temasek Junior College 6-Year Integrated Programme provides a seamless progression of learning, empowering students beyond the basics by exposing them to both breadth and depth, leading up to the GCE A-Level Examination in Year 6. The design of the 6-year IP curriculum supports integrative and interdisciplinary learning, extending 'Beyond Basics' through the core curriculum, 'Beyond Boundaries' through extended learning and 'Beyond Self' through student development. It aims at 'Temasek Excellence', engendering in students greatness in intellect, character and leadership. At TJC IP, students have a plethora of programmes to whet their appetites on. There are signature IP programmes crafted by our school such as Temasek Academy Unbound (Stretch Programme for Science and Humanities students), Wonder.Observe.Weave! attachment, World without Borders, Temasek Stewardship Programme, and Temasek Student Leadership Congress. In addition, there are MOE Elective Programmes - Music Elective Programme (Year 1 to 6), Chinese Language Elective Programme (Year 3 to 6) and Humanities Programme (Year 5 and 6). All TJC IP students will be holistically developed, going forth to green the world. (Please refer to our website for information on Scholarships and Financial Assistance.)"
JURONG JUNIOR COLLEGE,http://www.jurongjc.moe.edu.sg,800 CORPORATION ROAD,649809,65624611,na,65624505,na,jjc@moe.edu.sg,"Lakeside, Boon Lay","99, 157, 185, 198, 507, NR5, 502, 625, 174, 174M",DR HANG KIM HOO,"MR WONG TIEN CHIEH, GLENN",MDM LIM WAI PING PATRICIA,MR CHUA KAH SHENG,MISS THIEN KIEN SAN SHARON,na,"College of Choice, Education of Value","Nurturing confident leaders with a global outlook, developing leaders of character with a heart to serve",na,JURONG WEST,WEST,WEST 6,GOVERNMENT SCHOOL,CO-ED SCHOOL,FULL DAY,JUNIOR COLLEGE,No,No,No,No,Chinese,Malay,Tamil,1. Experiential Learning Programmes (ELP) 2. Entrepreneurship 3. Interest Development Programme
ANDERSON JUNIOR COLLEGE,ajc.moe.edu.sg.,4500 ANG MO KIO AVENUE 6,569843,64596822,na,64598734,na,anderson_jc@moe.edu.sg,Yio Chu Kang,"13, 86, 162, 269, 825, 851, 852, 853",MISS TAY LAI LING,MR CHAN TECK HONG DAVID,MISS LOW BEE YEN,MR NGEOW SIONG CHYE,na,na,"Passionate Learners, Adventurous Thinkers, Caring Leaders",To mould men and women of purpose and character,na,ANG MO KIO,NORTH,NORTH 5,GOVERNMENT SCHOOL,CO-ED SCHOOL,FULL DAY,JUNIOR COLLEGE,No,No,No,No,na,na,na,"Science research, service-learning, student leadership training, GP improvement & enrichment programmes"
VICTORIA JUNIOR COLLEGE,http://www.victoriajc.moe.edu.sg/,20 MARINE VISTA,449035,64485011,na,64438337,na,victoria_jc@moe.edu.sg,"Nearest MRT Stations:  Kembangan, Eunos","13, 16, 31, 36, 43, 48, 55, 135, 196, 196e, 197",MISS EK SOO BEN,MR SINGH GURUSHARAN S/O M SINGH,MR CHEONG TIEN BENG,MDM CHUA NGA WOON,na,na,LiVE like a Victorian - Legendary Spirit - Visionary Leadership - Extraordinary Service,"To ignite the imagination of all Victorians to create the future with conviction, courage and compassion",na,BEDOK,EAST,EAST 7,GOVERNMENT SCHOOL,CO-ED SCHOOL,FULL DAY,JUNIOR COLLEGE,No,No,No,Yes,Chinese,Malay,Tamil,Arts Programme  Beyond Borders Programme Higher Education Guidance Programme Olympiad Training Programme Overseas Exchange Programme Scholarship and Mentoring Programme Victoria Science Research Talent Development Programme  Student Leadership Programme   Career Guidance and Work Attachment
YISHUN JUNIOR COLLEGE,http://www.yishunjc.moe.edu.sg/,3 YISHUN RING ROAD,768675,62579873,na,62574373,na,YISHUN_JC@MOE.EDU.SG,"Yishun, Khatib","800, 812, 167, 169, 171, 980",MRS EDELWEIS NEO,MR NG PING HWEE,MR LIM CHENG TJU,MDM TAN SWEE ENG JENNIFER,na,na,The Choice College of Leaders with Passion and Integrity,"To nurture righteous leaders, responsible global citizens, who pursue excellence in all endeavours",na,YISHUN,NORTH,NORTH 8,GOVERNMENT SCHOOL,CO-ED SCHOOL,FULL DAY,JUNIOR COLLEGE,No,No,No,No,na,na,na,"1. Digital art (includes 3D animation, digital painting, jewellery design, architectural design, fashion design & Ulead Studio).2. Music Programme including the following 3 components:a) Listening/Analysis/History; b)Composition Folio - electroacoustic musics and c) Performance."
TAMPINES JUNIOR COLLEGE,http://www.tpjc.moe.edu.sg/,2 TAMPINES AVENUE 9,529564,67841955,na,67810061,na,tpjc@moe.edu.sg,None,"3, 9, 12, 17, 19, 21, 28, 29, 37, 81, 293, 518",MISS YOONG NYOK KE PAMELA,MR ANG YEOU PENG,MDM TAN YIN LENG,MR TAN ENG POH,na,na,A Leader in Every Student.,"To inculcate excellence of achievement, a passion for learning and a zest for life.",na,TAMPINES,EAST,EAST 6,GOVERNMENT SCHOOL,CO-ED SCHOOL,FULL DAY,JUNIOR COLLEGE,No,No,No,No,na,na,na,"Overseas VIA Project, School Twinning Programme (Shandong Experimental High School), School Twinning Programme (Pusat Tingkatan Enam Tutong, Brunei)"
SERANGOON JUNIOR COLLEGE,http://www.srjc.moe.edu.sg,1033 UPPER SERANGOON ROAD,534768,62850779,na,62825318,na,srjc@moe.edu.sg,Kovan MRT,"25,55,80,81,82,85,97,101,107,111,112.113,119,132,136,153",MR MANOGARAN S/O SUPPIAH,MRS KOH CAIYU,MISS WANG SIEW PING,MDM SHIRLEY YONG WAI YEE,na,na,Leaders and Learners driven by Values and Imagination,"Inspiring all students to have the passion to learn, the heart to serve and the courage to lead",na,HOUGANG,NORTH,NORTH 4,GOVERNMENT SCHOOL,CO-ED SCHOOL,FULL DAY,JUNIOR COLLEGE,No,No,No,No,na,na,na,"Camp ASPIRE:Advanced Student Leadership Programme;SR Global Classroom Experience:Educational Fieldtrips and Community Projects;Get REAL!:Reach out to the Environment,Aged and Less Fortunate"
PIONEER JUNIOR COLLEGE,http://www.pioneerjc.moe.edu.sg,21 TECK WHYE WALK,688258,65646878,na,67651861,na,PJC@MOE.EDU.SG,Choa Chu Kang,"975, 190, 985",MDM KEK LEE YONG,MR LEONG CHI-YUNG KEN,MISS SEET YING LING BRITTA,MISS SIM YOKE HWEE,na,na,"ALWAYS SERVING, ALWAYS LEARNING",Nurturing a community of committed learners and compassionate leaders,na,CHOA CHU KANG,WEST,WEST 2,GOVERNMENT SCHOOL,CO-ED SCHOOL,FULL DAY,JUNIOR COLLEGE,No,No,No,No,Chinese,na,na,Sports and outdoor electives
MERIDIAN JUNIOR COLLEGE,http://www.mjc.moe.edu.sg,21 PASIR RIS STREET 71,518799,63493660,na,63493667,na,meridian_jc@moe.edu.sg,Pasir Ris MRT Station,"3, 53, 81, 89",MR LIM YAN HOCK,MDM TOH LAY HAR,MR HAN WEE FONG (HAN WEIFENG),MR LIM KWEE HONG KYLE,na,na,"A leading institution acclaimed for its academic distinction and richness of learning experiences, in a culture of initiative and empowerment.","To cultivate learned men and women of calibre, with the heart and will to lead and serve in a challenging world.",na,PASIR RIS,EAST,EAST 1,GOVERNMENT SCHOOL,CO-ED SCHOOL,FULL DAY,JUNIOR COLLEGE,No,No,No,No,Chinese,Malay,Tamil,"Chrystal Programme, Careers & Scholarships Programme, Talent Management Programme, Leadership Development Programme, Reach Programme, Enrichment Programme (Xcite!, Ignite!, iLive, Intr!gue. Sparks)"
INNOVA JUNIOR COLLEGE,http://www.innovajc.moe.edu.sg/,21 CHAMPIONS WAY,737902,63983401,na,68943655,na,innova_jc@moe.edu.sg,Woodlands MRT,"161,168,901,900A",MR MICHAEL DE SILVA,"MR SOH SZE FUN, VICTOR",MR TAY YUAN ZHUANG,MDM LEE BENG CHOO,na,na,A forward-looking community of leaders and thinkers,Develop future-ready leaders and thinkers,na,WOODLANDS,NORTH,NORTH 7,GOVERNMENT SCHOOL,CO-ED SCHOOL,FULL DAY,JUNIOR COLLEGE,No,No,No,No,Chinese,Malay,Tamil,"Future Readiness Development Programme, Student Leadership Development Programme, Innova Confident Communicators (ICON) Programme, Global Immersion and Exchange Programmes, Innova Scholars Programme (ISP)."
EUNOIA JUNIOR COLLEGE,na,53 MOUNT SINAI ROAD,276880,na,na,na,na,na,na,na,MDM CHEANG MEI HENG,MR BOY ENG SENG,MR POH CHUN LECK,na,na,na,na,na,na,NO,NORTH,NORTH 1,GOVERNMENT SCHOOL,CO-ED SCHOOL,na,JUNIOR COLLEGE,No,No,No,Yes,Chinese,Malay,Tamil,na
CATHOLIC JUNIOR COLLEGE,http://www.cjc.edu.sg,129 WHITLEY ROAD,297822,62524083,na,62537267,na,catholic_jc@moe.edu.sg,Toa Payoh MRT Station Novena MRT Station Orchard MRT Station,"105, 132, 151, 153, 154, 156, 186, 996, 985",MDM CHUA SUAN GEK PHYLLIS,MR TAN JEK SUAN,MRS YUE-CHANG TECK HUI,MR GAN THIAM SOON ALLAN,na,na,CJC: a place of excellence in learning and living.,"We cultivate in each young person the skill and attitude to embrace challenges wisely and courageously. We foster a community that cares for the dignity of young people, nurturing them to be men and women of compassion. We broaden their vision so that they become leaders committed to serve in faith and with integrity.",na,NOVENA,SOUTH,SOUTH 5,GOVERNMENT-AIDED SCH,CO-ED SCHOOL,FULL DAY,JUNIOR COLLEGE,No,No,No,No,na,na,na,Religious / Ethics Programme Overseas Community Projects (10 countries 2008) National Youth Achievement Award (NYAA)  Integrated Leadership Development COL@C : Curriculum Online At CJC
ANGLO-CHINESE JUNIOR COLLEGE,http://www.acjc.edu.sg,25 DOVER CLOSE EAST,139745,67750511,na,67775479,na,acjc@acjc.edu.sg,Buona Vista,"74,95,100,105,106,111,145,147,191,196,198,602",MISS CHONG CHOY HOONG BEATRICE,MDM SEOW HONG KIANG,MRS LEE BEE CHEOW,MR DAVID ALLAN D'SOUZA,na,na,"Noble Ambition and Character, for the Service of God and nation.","ACJC is a Methodist Institution committed to an all-round education of the highest standards based on Christian principles and a consciousness of self, others and God.",na,QUEENSTOWN,WEST,WEST 1,GOVERNMENT-AIDED SCH,CO-ED SCHOOL,FULL DAY,JUNIOR COLLEGE,No,No,No,No,na,na,na,"MOE Music and Drama Elective, MOE Humanities and Pre-U Scholarships,  Science Research Programme, ACJC-A*STAR Science Research Symposium, Humanities Symposia, ACJC-EDB Entrepreneurship Education Programme, Performing Arts Programme, ACJC Seminar Series, Extensive Community Involvement Programmes"
ST. ANDREW'S JUNIOR COLLEGE,http://www.standrewsjc.moe.edu.sg/,5 SORBY ADAMS DRIVE,357691,62857008,62852007,62850037,na,sajc@moe.edu.sg,Potong Pasir NE10,"SBSTransit: 8, 26, 31, 90, 142 ,151, 154 (Diocese of Singapore) SMRT Buses:  857, 966, 985 (Diocese of Singapore),  853 (Upper Serangoon Road)",MR LO KHEE TIAN MARK,MR ANG KHENG SAN CECIL,MR CHAN KWANG HOW BERNARD,na,na,na,Home of Servant Leaders Who Bring Life To The Nations,Making Lives and Waking Hearts To Serve The Coming Days Family-Society-Eternity,na,TOA PAYOH,SOUTH,SOUTH 5,GOVERNMENT-AIDED SCH,CO-ED SCHOOL,FULL DAY,JUNIOR COLLEGE,No,No,No,No,na,na,na,"Academic Pacing Programme, University Options Seminar, Exit Seminars, Work Shadowing, Arts Enrichment Programme, Mentoring and Overseas Community Service."
NANYANG JUNIOR COLLEGE,http://www.nanyangjc.moe.edu.sg/,128 SERANGOON AVENUE 3,556111,62842281,na,62855147,na,nyjc@moe.edu.sg,2-minute walk from the Lorong Chuan MRT Station (Circle Line),"22, 24, 53, 73, 133, 105, 135, 136, 156, 853",MR KWEK HIOK CHUANG,MR LOW CHUN MENG,MISS MOH CUI RONG REBECCA,MR ANG KAY YONG JEREMY,MR NING TAU YEE,na,A leading college serving the nation with: - Enhanced character development - Quality staff - Quality learners - Organisational excellence,Uphold Values Enhance Lifeskills Maximise Potential,na,SERANGOON,SOUTH,SOUTH 6,GOVERNMENT-AIDED SCH,CO-ED SCHOOL,FULL DAY,JUNIOR COLLEGE,No,No,No,No,na,na,na,"Art Elective Programme (AEP), Language Elective Programme (Chinese) (CLEP), Student Leadership Development Programme, Overseas Service-Learning Programme, Career Guidance Programme, Scholar Development Programme, S6 Centre of Excellance for CL and Art"
HWA CHONG INSTITUTION,http://www.hwachong.edu.sg,661 BUKIT TIMAH ROAD,269734,64683955,64683956 / 64665912,67695857,na,admin@hci.edu.sg,TAN KAH KEE MRT,"66, 67, 74, 151, 154, 156, 157, 170, 171, 174, 852, 961",DR HON CHIEW WENG,MR CHAN KWOK LEONG,MDM CHIN-LEOW BEE KUAN,DR CHUNG WEN CHEE,DR YEO HWEE JOO,na,"Defining Holistic Education, and Empowering our students to Live with Passion and Lead with Compassion.","We nurture leaders in research, industry and government to serve our nation.","Hwa Chong Institution's (HCI) mission is to nurture leaders for the nation: leaders with a heart to serve the community.  To date, HCI has produced 56 President's Scholars.  Indeed, Hwa Chong is more than a school that produces top scholars. We also want our students to embrace the values of hard work, integrity, passion, and compassion.  All our students receive a sustained character education which encourages them to work with the community through local and global service-learning initiatives.  At Hwa Chong, students approach life with passion. The school provides a caring environment that is intellectually stimulating, secure, and joyful. It offers a curiosity-driven 6-year Integrated Programme (IP). Drawing from the best of East and West, HCI has an extensive global network that links our students to leading universities and industry partners. Working closely with industry captains and professors, students are encouraged to pursue multidisciplinary interests.  Each year, our students go on to leading institutions for their undergraduate study, with a strong entry to some of the world's best universities.  All Hwa Chong students are also committed to serving society.  Hwa Chong prides itself on grooming servant leaders who display civic responsibility and empathy.  Annually, Hwa Chong students provide support and companionship to the underprivileged. Beyond offering assistance, many have partnered key welfare organisations to helm innovative societal projects.  As active contributors to civil society, Hwa Chong students have reached out both locally  and  overseas, tackling issues of  poverty, illiteracy and inequality.  Often, all these student-led projects mark the beginning of a long-term commitment to service.",BUKIT TIMAH,WEST,WEST 6,INDEPENDENT SCHOOL,CO-ED SCHOOL,SINGLE SESSION,MIXED LEVEL,Yes,No,No,Yes,Chinese,na,na,"MOE   Humanities  Programme,  MOE Art Elective Programme, MOE  Bicultural Studies Programme, MOE Language Elective Programme (Chinese),   Hwa  Chong Talent  Development Programmes - Science & Math Talent, School-Based Gifted Education, Ong Teng Cheong Leadership, Gifted and Talented Education, Entrepreneurial Leadership Boarding, Infocomm, Arts & Sports, Global Outreach, Week-long Sabbaticals  (every  term),  Service Learning, Third Languages (French, German, Japanese, Malay), Future Problem Solving, Advanced Science Research  (including  Biomedical,  Biotechnology and Bioengineering, Defence Science, Environmental Engineering, Nanotechnology, Material Science, Interactive  Digital  Media  & Electronics), Hwa Chong-Beijing satellite campus, Xi'an and Wuxi winter campuses, Western Immersions, Stanford and John Hopkins summer programs."
MILLENNIA INSTITUTE,http://www.millenniainstitute.moe.edu.sg,60 BUKIT BATOK WEST AVENUE 8,658965,63023700,na,63023767,na,millennia_inst@moe.edu.sg,Bukit Batok (NS-2),"66, 157, 174, 174E, 506 , 178, 941, 174M - Night",MRS TAN WAN YU,MS TNG YA WEN VALERIE,MR HSU YU CHIH TOMMY,na,na,na,"A Forward-looking Community of Learners, Thinkers and Leaders","Nurturing Talents to Achieve Success. The MI mission is to nurture our students to be grounded on the core values of INTEGRITY, RESILIENCE, RESPECT and RESPONSIBILITY, so that they succeed as contributing members of society.  This is done, in partnership with our stakeholders, by providing a variety of programmes and opportunities to students to have a broad-based learning experience and space to pursue their passion and interests.",na,BUKIT BATOK,WEST,WEST 7,GOVERNMENT SCHOOL,CO-ED SCHOOL,FULL DAY,CENTRALISED INSTITUTE,No,No,No,No,Chinese,Malay,Tamil,"MI.World, SkillsFuture, Gap Week, Design Thinking and I & E motivate and equip students with academic and life skills, 21C Competencies to be future-ready and creative and inventive thinkers and empower students to plan their own holistic development."
BUKIT PANJANG PRIMARY SCHOOL,http://www.bukitpanjangpri.moe.edu.sg,109 CASHEW ROAD,679676,67691912,na,67637462,na,BPPS@MOE.EDU.SG,From Pending LRT station to Choa Chu Kang MRT station,"75, 184",MR BUCKTHA SEELAN,MDM GOH PUAY HOON JENNY,MR TAN SENG CHUAN,na,na,na,"Future Leaders, Concerned Citizens",We are committed to provide a nurturing and thinking environment so as to develop respectful and responsible pupils who value teamwork and life-long learning.,na,BUKIT PANJANG,WEST,WEST 8,GOVERNMENT SCHOOL,CO-ED SCHOOL,SINGLE SESSION,PRIMARY,No,No,No,No,Chinese,Malay,Tamil,"Extensive Reading Programme, Learning Support Programme, Pupil Leadership Development, Character Development Programme, Passion Into Action Programme, Enrichment Programmes including Mathematics Olympiad Training, Sony Creative Toys, New South Wales Competitions, Music with Technology."
HAIG GIRLS' SCHOOL,http://www.haiggirls.moe.edu.sg,860 NEW UPPER CHANGI ROAD,467353,63440293,na,64474169,na,HAIGGIRLSSCH@MOE.EDU.SG,"Bedok, Tanah Merah","16,33,32,40,10,12,14,",MISS LO YEN NIE,MISS PHUA AI LEI,MDM LEE LI LI,na,na,na,"Leaders of Character, Striving for Excellence in a Vibrant School",To nurture self-directed learners and critical and creative thinkers who lead and serve with integrity and compassion.,na,GEYLANG,EAST,EAST 5,GOVERNMENT SCHOOL,GIRLS' SCHOOL,SINGLE SESSION,PRIMARY,No,No,No,No,Chinese,Malay,Tamil,"Prog for Character and Citizenship Education Development, Prog for Arts Education: Teaching Through The Arts, Holistic Assessment, D3T2 (Discover,Develop & Dedicate your Talent Time), Applied Learning Prog:Integrated Project Work, Learning for Life Prog:Music & Performing Arts; Visual Arts & Design."
TECK WHYE PRIMARY SCHOOL,http://www.teckwhyepri.moe.edu.sg,11 TECK WHYE WALK,688261,67691025,na,67635191,na,twps@moe.edu.sg,Chua Chu Kang MRT & LRTs,"975, 190 & 985",MR SURAJ NAIR S/O VENUGOPAL,MRS ONG LAY KHIM,MDM TAN WAN PHING JANICE,na,na,na,A future-ready community of passionate learners  anchored in values and striving for excellence  to make a positive difference.,Inspiring and empowering our learners to be their best for self and others through a supportive environment and innovative & effective teaching-learning practices.,na,CHOA CHU KANG,WEST,WEST 5,GOVERNMENT SCHOOL,CO-ED SCHOOL,SINGLE SESSION,PRIMARY,No,No,No,No,Chinese,Malay,Tamil,"Programmes to help the school achieve academic and character excellence: -  Applied Learning Programme - Media Whiz Kids! (Media-based Programmes) Learning for Life Programme - I Lead, I Serve (Leadership Development Programme)"
JURONG PRIMARY SCHOOL,http://www.jurongpri.moe.edu.sg,320 JURONG EAST STREET 32,609476,65618837,na,65641964,na,JPS@MOE.EDU.SG,"Lakeside MRT Station, Jurong East MRT Station",333,MRS MANOKARA SUGUNAVATHI,MDM CHERYL CHOO SHUEH-LI,MR KOH SEE CHOON,na,na,na,A vibrant community of gracious citizens and passionate learners,"We nurture all-rounded pupils of grace, distinction and sound moral values,ready to take on future endeavours.",na,JURONG EAST,WEST,WEST 4,GOVERNMENT SCHOOL,CO-ED SCHOOL,SINGLE SESSION,PRIMARY,No,No,No,No,Chinese,Malay,Tamil,"Demo school for IT, UAP & LSP Video Conferencing w GERMANY BEST (Brush Everyday for Shining Teeth) EFG (We Eat More Fruit & Greens) Maths Clinic Claymation Dazzle Video Digital Art Web Savvy Robotics Junior Entrepreneurship Chinese Calligraphy for Non- Chinese pupils Project Hatch"
QUEENSTOWN PRIMARY SCHOOL,http://www.queenstownpri.moe.edu.sg,310 MARGARET DR,149303,64741044,na,64713640,na,qtps@moe.edu.sg,Queenstown MRT,"32, 111, 145, 195",MISS NG POR JOO PEARLY,MRS HELEN TAN,MISS POON PEI PING,na,na,na,A Child. An Explorer. A Friend.,"To provide a holistic education so as to develop confident and self-directed learners, concerned citizens and active contributors.",na,QUEENSTOWN,SOUTH,SOUTH 2,GOVERNMENT SCHOOL,CO-ED SCHOOL,SINGLE SESSION,PRIMARY,No,No,No,No,Chinese,Malay,Tamil,"Structured Remedial/Supplementary Prog CDAC Tuition Prog Reading Mums Prog P1 EL Foundation Prog P6 Morning Revision Prog Pre-Assembly Prog Queensway Sec. Math Mentoring Prog ""Let's Learn It"" Math Prog Creative Toy-Making Sci Prog IT Prog Project Work Learning Journeys CIP Prog"
RADIN MAS PRIMARY SCHOOL,http://www.radinmasps.moe.edu.sg,1 BUKIT PURMEI AVENUE,99840,62733937,na,62763083,na,rmps@moe.edu.sg,Tiong Bahru MRT HarbourFront MRT,"SBS 123, 131, 275 SBS 65",MRS WONG SIEW SHAN,MR LOW MIN CHYE,MR KWOK KENG LIAN,na,na,na,"A School Where All Work Hard, Play Hard And Make A Mark","To Develop Each Child Holistically, Equipping Him With Competences For The Future",na,BUKIT MERAH,SOUTH,SOUTH 4,GOVERNMENT SCHOOL,CO-ED SCHOOL,SINGLE SESSION,PRIMARY,No,No,No,No,Chinese,Malay,Tamil,Problem-based Learning & WebQuest 6-year Digital and Animation programme Level-Based ICT Programmes E-Learning
RAFFLES GIRLS' PRIMARY SCHOOL,http://www.rafflesgirlspri.moe.edu.sg,21 HILLCREST ROAD,289072,64684377,na,64692024,na,RGPS@MOE.EDU.SG,NEWTON MRT STATION,"66, 67, 74, 151, 154, 156, 157, 170, 171, 174, 852, 961",MRS YUE YOKE MUN NEE WAI,MDM GOH LUNG ENG,MDM GERMAINE NG YING- HAN,MR LIM BOON TECK,na,na,"A premier school with a vibrant, caring community.",To develop our pupils to be useful citizens and lifelong learners.,na,BUKIT TIMAH,SOUTH,SOUTH 3,GOVERNMENT SCHOOL,GIRLS' SCHOOL,SINGLE SESSION,PRIMARY,No,No,Yes,No,Chinese,Malay,Tamil,"Enrichment programmes: P1 & P2 Speech and Drama P1, P2 and P3 Swimming Programme P3 and P4 Art Programme P4, P5 and P6 Ceramics Programme P5 & P6 Home Economics P5 Music Programme"
