school_name,url_address,address,postal_code,telephone_no,telephone_no_2,fax_no,fax_no_2,email_address,mrt_desc,bus_desc,principal_name,first_vp_name,second_vp_name,third_vp_name,fourth_vp_name,fifth_vp_name,visionstatement_desc,missionstatement_desc,philosophy_culture_ethos,dgp_code,zone_code,cluster_code,type_code,nature_code,session_code,mainlevel_code,sap_ind,autonomous_ind,gifted_ind,ip_ind,mothertongue1_code,mothertongue2_code,mothertongue3_code,special_sdp_offered
ANGLO-CHINESE SCHOOL (JUNIOR),www.acsj.moe.edu.sg,16 WINSTEDT ROAD,227988,67337911,67337912,67346518,na,acjs@moe.edu.sg,Newton MRT Station,"5, 54 , 124 , 128 , 143 ,162 , 162M , 167 , 171 , 700 and 700A.",MRS CHAILLAN MUI TUAN,MRS LIM- FOO BOON CHING,MR MORGAN ZHOU YOU QIN,na,na,na,"Every ACSian, a young gentleman of character ready for the future to lead and to serve.","To nurture our pupils with a quality, holistic education, rooted in Christian values, that allows each to reach his fullest potential, equipped with life skills to face the future and to serve God and nation.",na,CENTRAL,SOUTH,SOUTH 5,GOVERNMENT-AIDED SCH,BOYS' SCHOOL,SINGLE SESSION,PRIMARY,No,No,No,No,Chinese,Malay,Tamil,"Learning Support Programme, ENABLE, Life Skills Enrichment Programme, Character Development Programme Gymnastics and Swimming Programme for P3"
CANOSSA CONVENT PRIMARY SCHOOL,http://www.canossaconventpri.moe.edu.sg/,1 SALLIM ROAD,387621,68441418,na,68441417,na,ccps@moe.edu.sg,Macpherson MRT Station,"40,61,63,65,66,135,154,155,158",MISS TAN LEE YIN GRACE,MDM WONG WAN CHIN,MR LEE HENG WENG,na,na,na,"A community of compassionate leaders and passionate learners, in service of God, country and family.","To nurture and empower Canossians through a holistic education to be persons of integrity, committed to serving God and others.",na,GEYLANG,EAST,EAST 5,GOVERNMENT-AIDED SCH,GIRLS' SCHOOL,SINGLE SESSION,PRIMARY,No,No,No,No,Chinese,Malay,Tamil,"Enriched Instructional Programme for High Ability pupils, Canossian Values Education programme, Leadership Programme, Arts Education Prog, Performing Arts, Ballet for Lower Primary, Integration of ICT into Learning, Ecube(Exposure, Experience & Excursion) prog"
CHIJ PRIMARY (TOA PAYOH),http://www.chijpritoapayoh.moe.edu.sg,628 LORONG 1 TOA PAYOH,319765,63532164,na,63536362,na,CHIJTPPS@MOE.EDU.SG,Toa Payoh,"59, 231, 141",MRS TAN SOON KEE MARGARET,MDM MISCHA LEIGH PEREIRA,MDM AUDREY KANG,na,na,na,"A choice school providing the IJ legacy of a holistic education where girls become women of character, women for others, able to meet life's challenges with God as their Shepherd.","CHIJ Primary (Toa Payoh) believes in the creation of a Christ-centred school community where all work together for the promotion of truth, justice, freedom and love, with special reference to the needs of the pupils who are disadvantaged in any way.",na,TOA PAYOH,SOUTH,SOUTH 3,GOVERNMENT-AIDED SCH,GIRLS' SCHOOL,SINGLE SESSION,PRIMARY,No,No,No,No,Chinese,Malay,Tamil,1.Confidence-Building Programmes 2.Spiritual & Emotional Development Programmes 3.Student Empowerment Programmes 4.Service Learning Programmes 5.Self-Management Programmes 6.Nation-Building Programmes 7.'IJ Goes Global' Programme 8. Curriculum Enhancement Enrichment Programmes
CHIJ (KELLOCK),http://www.chijkellock.moe.edu.sg/,1 BUKIT TERESA ROAD,99757,62730096,na,62731710,na,CHIJKS@MOE.EDU.SG,Outram Harbourfront,"61,124,143,166",MDM CHIN MING YEW MAGDALENE,MDM SEOW SWEE NEO CHRISTINA,MDM QUEK TSUI LAN PRISCA,na,na,na,A Christ-centred learning community where every child will develop her own unique giftedness to lead and make a difference.,"A Christ-centred school community where all work together for the promotion of truth, justice, freedom and love, with special reference to the needs of the persons who are disadvantaged in any way.",na,BUKIT MERAH,SOUTH,SOUTH 4,GOVERNMENT-AIDED SCH,GIRLS' SCHOOL,SINGLE SESSION,PRIMARY,No,No,No,No,Chinese,Malay,Tamil,"School-wide (P1-6) EL/MTL Fortnight, Financial Literacy, Values @ Play, Children for Children, Kellock Arts Jamboree, Project Work"
CHIJ OUR LADY OF THE NATIVITY,http://www.chijourladyofthenativity.moe.edu.sg/,1257 UPPER SERANGOON ROAD,534793,63852455,na,63852012,na,chijoln@moe.edu.sg,Hougang MRT,"74, 136, 147, 102, 112, 113, 119, 136",MDM CHRISTINA TEO,MDM CHONG LAI CHOO VIVIEN,MDM YVONNE LIM BUAY HUANG,na,na,na,To provide a nurturing and supportive learning environment where pupils are developed to their fullest potential with a passion for life-long learning and a readiness to serve others.,"The Mission of an Infant Jesus Convent is the creation of a Christ-centred school community where all work together for the promotion of truth, justice, freedom and love, with special reference to the needs of the pupils who are disadvantaged in any way.",na,HOUGANG,SOUTH,SOUTH 6,GOVERNMENT-AIDED SCH,GIRLS' SCHOOL,SINGLE SESSION,PRIMARY,No,No,No,No,Chinese,Malay,Tamil,"Artstravanganza!, Buddy Reading&Writing, Performing Arts(Dances),Enrichment Prog(Core subj), Camps(P1-6,MT), ViA, IPW"
DE LA SALLE SCHOOL,http://www.delasalle.moe.edu.sg,11 CHOA CHU KANG ST 52,689285,67667675,na,67622075,na,dlss@moe.edu.sg,YEW TEE MRT,"TIBS 302, 979",MDM DAPHNE POON CHOR CHOO,MR CHING KIN HIN,MR SIM KOOI SUEN,na,na,na,"Lifelong Learners, Caring Citizens",Enabling youth in a Lasallian community to learn how to learn and to learn how to live; empowering them to be men of integrity and men for others,na,CHOA CHU KANG,WEST,WEST 2,GOVERNMENT-AIDED SCH,CO-ED SCHOOL,SINGLE SESSION,PRIMARY,No,No,No,No,Chinese,Malay,Tamil,na
ST. ANDREW'S JUNIOR SCHOOL,http://www.saintandrewsjunior.moe.edu.sg,2 FRANCIS THOMAS DRIVE,359337,62884303,na,62895242,na,sajs@moe.edu.sg,"Potong Pasir,Toa Payoh","8,13,26,31,90,90A,107,133,142,147,853, NR6",MISS NEO PHEI TZE PATSY,MR THAM KINE CHUEN THOMAS,MDM SNG YEE YEE JOSEPHINE,na,na,na,"A Learning Community where each SAINT is a Gentleman, a Leader and an Ambassador.","St Andrew's nutures every individual to achieve his best in a broad and balanced range of activities, to become a disciplined, life-long learner and to develop sound values based on Christian teachings so that each may become a fulfilled human being of worth and a contributing citizen of Singapore and the world.",na,TOA PAYOH,SOUTH,SOUTH 5,GOVERNMENT-AIDED SCH,BOYS' SCHOOL,SINGLE SESSION,PRIMARY,No,No,No,No,Chinese,Malay,Tamil,"Reading Programme, Rugby and Hockey Development, Arts Appreciation Programme, Character Development Programme, 1:1 Computing Programme, Learning Support Programme, P3 Swimming Programme and P3 Modular CCA."
ST. ANTHONY'S CANOSSIAN PRIMARY SCHOOL,http://www.stanthonyscanossianpri.moe.edu.sg,1602 BEDOK NORTH AVE 4,469701,64492239,na,64492146,na,sacps@moe.edu.sg,Bedok MRT,17,MDM SIA LU-MING EUGENIE,MDM CHUA KIM LAN JUDY,MRS IRENE GOH HOCK NGUAN,na,na,na,Leaders with a Heart for Others.,To nurture and empower Canossians to be persons of integrity committed to serving God and others.,na,BEDOK,EAST,EAST 4,GOVERNMENT-AIDED SCH,GIRLS' SCHOOL,SINGLE SESSION,PRIMARY,No,No,No,No,Chinese,Malay,Tamil,Pastoral Care Programme (God Loves Me)and Performing Arts Programme
ST. GABRIEL'S PRIMARY SCHOOL,http://www.stgabrielspri.moe.edu.sg,220 LORONG CHUAN,556742,62803628,na,63820344,na,STGPS@MOE.EDU.SG,Lor Chuan MRT Station (Circle Line),"73, 105, 105A, 159",MRS CATHERINE CHIANG,MR SOH KAI GUAN,MR KEITH TAN CHIN HENG,na,na,na,"A Gabrielite will be God-loving, disciplined, gracious, caring and a life-long learner.",Shaping Lives for Service to God and Nation.,na,SERANGOON,SOUTH,SOUTH 6,GOVERNMENT-AIDED SCH,BOYS' SCHOOL,SINGLE SESSION,PRIMARY,No,No,No,No,Chinese,Malay,Tamil,Character Education / Catechism classes for all Gabrielite pupils are conducted every Thursday. Gabrielite Star Pastoral Care programme. Mass is conducted at least once a Term. Structured IT Enrichment Programme for all pupils
ST. MARGARET'S PRIMARY SCHOOL,http://www.stmargaretspri.moe.edu.sg,99 WILKIE ROAD,228091,63394247,na,63394264,na,STMARGARETPS@MOE.EDU.SG,"Dhoby Ghuat, Little India (NEL)","64, 65, 65M, 85, 97, 103, 111, 131, 139",MISS PANG WEE MIAN,MDM ALISON ANG SIOK PHING,MDM MOEY KIT MING,na,na,na,"Led by God to be a Life-Long Learner, grounded on the values of Integrity, Graciousness, Humility and Tenacity.","The school was established for the education and nurture of young girls, that each may develop in body, soul and spirit, and be trained in righteousness to become a woman of God, equipped for every good work.",na,CENTRAL,SOUTH,SOUTH 6,GOVERNMENT-AIDED SCH,GIRLS' SCHOOL,SINGLE SESSION,PRIMARY,No,No,No,No,Chinese,Malay,Tamil,"Learning Support Programme for Maths & English; Proficiency in harmonica and recorder for all pupils; Gymnastics programme(Pri 2 & 3; SwimSafer Programme(Pri 2; KidzNet Programme (modified netball for Pri 1,2 & 3)"
ST. JOSEPH'S INSTITUTION JUNIOR,http://www.sjijunior.edu.sg,3 ESSEX ROAD,309331,62552700,na,62557455,na,sjijunior@moe.edu.sg,na,21;54;56;57;124;131;166;518;851,MR GOH HENG LIANG TIMOTHY,MRS LINDA TAN,MR LIM KOK YEOW WINSTON,na,na,na,Belief in Self  Excellence in All Service to Others True to One's Faith,Enabling youth in a Lasallian community to learn how to learn and to learn how to live; empowering them to become men of integrity and men for others.,na,NOVENA,SOUTH,SOUTH 5,GOVERNMENT-AIDED SCH,BOYS' SCHOOL,SINGLE SESSION,PRIMARY,No,No,No,No,Chinese,Malay,Tamil,JTP (Josephian Talent Programme)
ST. STEPHEN'S SCHOOL,http://www.ststephens.moe.edu.sg,20 SIGLAP VIEW,455789,62419513,64441645,64422576,na,STSTEPHENSCH@MOE.EDU.SG,Kembangan MRT Station,"2,7,24,25,26,28,30,32,33,67,854",MR KOH KIAN SENG THOMAS,MR TAYEB B RAJIB,MR CHEW SOO KWANG,na,na,na,"A community of caring, confident and independent learners serving and excelling for the glory of God.",Enabling all Stephenians to learn how to learn and to learn how to live; empowering them to become men of integrity and men for others.,na,BEDOK,EAST,EAST 7,GOVERNMENT-AIDED SCH,BOYS' SCHOOL,SINGLE SESSION,PRIMARY,No,No,No,No,Chinese,Malay,Tamil,"Character Development & Ethics Programme, Inter-Disciplnary Work, Programme for Active Learning (PAL), Parents Symposium, Sports Carnival, Adventure & PE camps, Brass Band and Dance overseas experience programme, Mother Tongue Fortnight"
CHIJ OUR LADY OF GOOD COUNSEL,http://www.chijourladyofgoodcounsel.moe.edu.sg,2C BURGHLEY DRIVE,558979,62886930,na,62814132,na,chijolgcs@moe.edu.sg,"Ang Mo Kio MRT, Bishan MRT, Serangoon MRT station.","317 Feeder Bus Service from Serangoon Interchange. 135,136 from Ang Mo Kio Interchange.",MDM WOON MEEN FAYE CATHERINE,MRS WONG-LIM ENG LING ANGELINA,MRS QUEK-SIM KIM LIANG ANNE,na,na,na,"Ladies of Grace and Character, Leaders of the Future. We envision our pupils to be  Global Resilient Aware Confident Enterprising","Together we build a Christ-centred school community for the promotion of truth, justice, freedom and love, nurturing and developing pupils to their full potential with special reference to the needs of the pupils who are disadvantaged in any way.",na,SERANGOON,SOUTH,SOUTH 1,GOVERNMENT-AIDED SCH,GIRLS' SCHOOL,SINGLE SESSION,PRIMARY,No,No,No,No,Chinese,Malay,Tamil,"TAF Programme, English Reading Programme, English & Maths Support Programme, Arts Education Programme, Character Development Programme, Community Involvement Programme & NLB Outreach Programme."
MONTFORT JUNIOR SCHOOL,http://www.montfortjunior.moe.edu.sg/,52 HOUGANG AVENUE 8,538786,65101588,na,65101599,na,MONTFORT_JS@MOE.EDU.SG,Hougang MRT & Bus Interchange,"74,88,101,147,161,",MR WONG KENG YUIN WILBUR,MISS THIEN LI CHIN,MDM NG LI YI,MISS CHUA CHEW HIANG,na,na,"A Montfortian, A Man for Others  Our School Values: 1) Compassion 2) Humility 3) Respect 4) Integrity 5) Service 6) Team spirit 7) Excellence","Montfort is a Catholic School.  Guided by our Montfortian values and spirituality, we nurture each individual to realise his potential and inspire him to be a Man for Others.",na,HOUGANG,NORTH,NORTH 4,GOVERNMENT-AIDED SCH,BOYS' SCHOOL,SINGLE SESSION,PRIMARY,No,No,No,No,Chinese,Malay,Tamil,I am a STAR Programme We are a Star Class programme Magical Pen - EL MJ Evolution - Interdisciplinary
CHIJ OUR LADY QUEEN OF PEACE,http://www.chijourladyqueenofpeace.moe.edu.sg/,4 CHESTNUT DRIVE,679287,67691529,na,67653551,na,CHIJOLQP@MOE.EDU.SG,Bukit Batok,"180, 67, 171, 176, 177, 178, 184, 961, 963, 970",MDM LIM KIM GEK,MISS CECILIA TAN LI HUA,MDM LOH AH LAH CATHERINE MICHELLE,na,na,na,"Learner, Leader, Lady A CHIJ OLQP pupil is a confident young lady who has moral character and genuine love for learning, leading and serving God and others.","A CHIJ School is a Christ-centered school community where all work together for the promotion of truth, justice, freedom and love, with special reference to the needs of persons who are disadvantaged in any way.",na,BUKIT PANJANG,WEST,WEST 8,GOVERNMENT-AIDED SCH,GIRLS' SCHOOL,SINGLE SESSION,PRIMARY,No,No,No,No,Chinese,Malay,Tamil,Physical Fitness Training Prog; Speech & Drama Prog; Art Enrichment Prog; Catholic Religious Education Prog; Playtime Prog;CLIMB Prog
FAIRFIELD METHODIST SCHOOL (PRIMARY),http://www.fmsp.moe.edu.sg/,100 DOVER ROAD,139648,67788431,na,67762948,na,fmsp@moe.edu.sg,"One-North MRT, Buona Vista MRT & Dover MRT","SBS Bus 14,33,74,166 & 196",MDM LAW LI MEI,MISS LIAT MEI KUEN GERALDINE SHARON,MR ANDREW NG SIOK KWANG,MR JAMES CHONG KOK CHIANG,na,na,"Leaders of the future pursuing excellence, upholding strong Christian moral values and having a heart to serve.","To provide a holistic education in a Christian environment so as to nurture leaders of good character, equipped to serve God, nation, community and school.",na,QUEENSTOWN,SOUTH,SOUTH 2,GOVERNMENT-AIDED SCH,CO-ED SCHOOL,SINGLE SESSION,PRIMARY,No,No,No,No,Chinese,Malay,Tamil,"Character Development, Leadership Development,IT enrichment,P5 adventure camp,P4 Outdoor Education Programme, Ceramics in Art Curriculum,Maths& Science Trail, Charity sale, Sports Carnival,Extensive reading, lang. week, Maths Olympiad Training, Radio DJ, Modular CCA, Gymnastic Programme for P1 & P2"
GEYLANG METHODIST SCHOOL (PRIMARY),www.gmsp.edu.sg,4 GEYLANG EAST CENTRAL,389706,67486746,na,67488980,na,GMPS@moe.edu.sg,Aljunied,"80, 155",MDM JENNIFER HAN ENG JUAN,MR YAK BENG WEI,MDM SEAH BEE HUI,MISS NG BEE KENG,na,na,"To develop every pupil into Self-Directed Learner, Compassionate Leader and Responsible and Useful Citizen.","A school of excellence where pupils and staff can grow in wisdom, stature and in favour with God and man.",na,GEYLANG,EAST,EAST 5,GOVERNMENT-AIDED SCH,CO-ED SCHOOL,DOUBLE SESSION,PRIMARY,No,No,No,No,Chinese,Malay,Tamil,Learning for Life Programme (Env Science) LEAD@ICT Programme SMART Reading Programme Rainbow Programme Reading Assistance Programme CINUX Programme for Chinese Language
KUO CHUAN PRESBYTERIAN PRIMARY SCHOOL,http://www.kuochuanpresbyterianpri.moe.edu.sg,8 BISHAN STREET 13,579793,62595396,na,62588012,na,KCPPS@MOE.EDU.SG,Bishan MRT Station,"76, 132, 165, 166, 169, 265, 268, 269",MDM TEO CHING LING,MISS CHEW MAY,MR LIM FONG HIM,na,na,na,"Ever Learning, Ever Glowing, Ever Abiding by the Truth of God.",To nurture a community of lifelong learners with Christian values to overcome challenges.,na,BISHAN,SOUTH,SOUTH 7,GOVERNMENT-AIDED SCH,CO-ED SCHOOL,SINGLE SESSION,PRIMARY,No,No,No,No,Chinese,Malay,Tamil,"ENABLE, SEED, Learning Support Programme EL, Learning Support Math, Gymnastics Prog. for P1 & P2, Pastoral Care Programme, Post-PSLE Programme,  E-Learning for P2 to P6 pupils, Parent Support Volunteer Group actively involved in school activities."
ST. HILDA'S PRIMARY SCHOOL,http://www.shps.moe.edu.sg,2 TAMPINES AVE 3,529706,67811916,na,67830527,na,shps@moe.edu.sg,Tampines,Feeder Bus service: 293 from Tampines Interchange (towards St 71),MDM KEW MEE YING,MR ANG WEI TECK,MDM GOH HUI CHENG,MISS PENNY NG LEE YONG,na,na,A Dynamic Learning Community that nurtures loyal citizens with global outlook and Godly character.,"As an Anglican school, we are committed to providing a balanced development of body, mind and spirit for our students and nurturing God-fearing citizens for our nation.","Every Hildan an Articulate, Confident, Innovative and Caring Ambassador.",TAMPINES,EAST,EAST 6,GOVERNMENT-AIDED SCH,CO-ED SCHOOL,SINGLE SESSION,PRIMARY,No,No,Yes,No,Chinese,Malay,Tamil,"Gifted Education Programme School Distinctive Programmes - Applied Learning Programme, Learning for Life Programme and Programme for Active Learning."
SINGAPORE CHINESE GIRLS' PRIMARY SCHOOL,www.scgs.moe.edu.sg,190 DUNEARN ROAD,309437,62527966,na,62523076,na,SCGPS@MOE.EDU.SG,"Newton, Botanic Gardens, Stevens","66, 105, 132, 151, 153, 154, 156, 170, 67, 171, 186, 190, 700, 960,605",MDM TAN YUNCHIN EUGENIA,MISS SUSANNA CHAU,na,na,na,na,To be an asset to the country by developing capable women of character and relevance.,"To inspire and develop every pupil to fulfil her fullest potential, according to her individual pace and aspirations, so as to prepare her for meaningful roles in the community.",na,NOVENA,NORTH,NORTH 2,GOVERNMENT-AIDED SCH,GIRLS' SCHOOL,SINGLE SESSION,PRIMARY,No,No,No,No,Chinese,Malay,Tamil,"The unique SCGS Experience will stretch pupils and provide avenues for them to scale their personal heights of excellence.  The 3 pillars of the SCGS Experience comprise the SCGS Talent Development Programme, the SCGS Character and Leadership Programme and the SCGS Living and Lifestyle Programme."
METHODIST GIRLS' SCHOOL (PRIMARY),http://www.mgs.sch.edu.sg,11 BLACKMORE DRIVE,599986,64694800,na,64624166,na,mgps@moe.edu.sg,King Albert Park MRT,"66, 67, 74, 151, 154, 157, 170, 171,174",MISS NG WUN HAR GRACE,MISS YAP FOON LYN,MR YIP WAI CHOONG,na,na,na,Godly women of Excellence with a heart of Love,"To educate every girl in A Christian environment in order that she may Master, Grow and Serve in every phase of her life",na,BUKIT TIMAH,WEST,WEST 3,GOVERNMENT-AIDED SCH,GIRLS' SCHOOL,SINGLE SESSION,PRIMARY,No,No,No,No,Chinese,Malay,Tamil,SOPHIA BLACKMORE CLASS
NAN CHIAU PRIMARY SCHOOL,http://www.ncps.moe.edu.sg,50 ANCHORVALE LINK,545080,64897905,na,64897906,na,NCPS@MOE.EDU.SG,Sengkang Station,"156, 159, 161, 371, 372",MDM QUAH LI LING MAE,MR LOH BIN,MDM LIM SHEUE TYUG,MR SEE CHAY MENG,na,na,An innovative school where inspiring educators nurture passionate learners of integrity.,"To foster the cognitive, physical, moral, aesthetic and social growth of pupils.",na,SENG KANG,NORTH,NORTH 4,GOVERNMENT-AIDED SCH,CO-ED SCHOOL,SINGLE SESSION,PRIMARY,No,No,No,No,Chinese,Malay,Tamil,"Character Devt Prog(ACE),Mobile Learning (ICT),Bicultural Chinese Elective Prog (BiCEP),Mycloud for Chinese,Learn through i-pod Touch,Recital of Chinese Classics,Alumni Weekend Enrichment lesson,Social Studies through Knowledge Building, Seamless learning for Science and English."
KONG HWA SCHOOL,http://www.konghwa.moe.edu.sg,350 GUILLEMARD ROAD,399772,63421195,na,63421120,na,KONGHWA_SCH@MOE.EDU.SG,Dakota,"Service 7,70,70M,197(to Guillemard Road)",MDM CHUA YE LING,MR YEE YEW LOONG,MDM FOO MEI PING,MR CHONG YEW BUN EDWARD,na,na,"Learning with Perseverance, Serving with Sincerity.",To bring out the best in every Kong Hwaian and to inculcate in him sound moral values and a passion to learn and serve.,na,GEYLANG,EAST,EAST 4,GOVERNMENT-AIDED SCH,CO-ED SCHOOL,SINGLE SESSION,PRIMARY,Yes,No,No,No,Chinese,na,na,Values Education and Character Building Programme. Bi-Cultural Programme. Flagship Programmes. Overseas Immersion Programmes.
MEE TOH SCHOOL,http://www.meetoh.moe.edu.sg/,21 EDGEDALE PLAINS,828867,64893326,na,64893243,na,MEETOH_SCH@MOE.EDU.SG,Punggol Station,"3,62,83",MR GAU POH TECK,MR LIM KIM THYE,MDM TAN LAY WAH,na,na,na,"Touching souls, Challenging minds.","To maximise pupils' potential and to develop in them a passion for life-long learning guided by compassion, conscience, purity and righteousness.",na,PUNGGOL,NORTH,NORTH 4,GOVERNMENT-AIDED SCH,CO-ED SCHOOL,SINGLE SESSION,PRIMARY,No,No,No,No,Chinese,Malay,na,"1)Chinese Drama-in-education: Dances with Books 2) 6-year School History Curriculum incorporating Social Studies, Art, English, Chinese and ICT 3)School Library Programme 4)Environment Education 5)ICT in Learning"
NGEE ANN PRIMARY SCHOOL,http://www.ngeeannpri.moe.edu.sg,344 MARINE TERRACE,449149,64418677,na,64417411,na,NAPS@MOE.EDU.SG,Nil,"13, 16, 31,36, 55, 608, 197, 196, 135 (at Marine Parade road) 13, 16 and 196 (at Marine Terrace)",MR KOE EE TIONG,MDM CHNG POH TEEN,MRS YVONNE TAN,na,na,na,"Excellent School, Caring Community",To Nurture Every Child To His Best,na,MARINE PARADE,EAST,EAST 7,GOVERNMENT-AIDED SCH,CO-ED SCHOOL,SINGLE SESSION,PRIMARY,No,No,No,No,Chinese,Malay,Tamil,NIL
RED SWASTIKA SCHOOL,http://www.redswastika.moe.edu.sg,350 BEDOK NORTH AVENUE 3,469719,64430380,na,62448391,na,REDSWASTIKA@MOE.EDU.SG,Bedok MRT,"Bus 14, 17, 18, 28, 66, 67, 69, 222, 227, 228",MRS LEONG- TAN LING LING JENNY,MDM POH QINYU,MDM SIEW YOKE YIN SERENE,MDM ONG LEE FONG,na,na,"Caring Community, Innovative Leaders.","To nurture a community of independent learners, effective communicators, active citizens, and innovative leaders.",na,BEDOK,EAST,EAST 2,GOVERNMENT-AIDED SCH,CO-ED SCHOOL,DOUBLE SESSION,PRIMARY,Yes,No,No,No,Chinese,na,na,"P1 & P2 Programme For Active Learning (PAL)  ICT Skills - Keyboarding Skills, MS Word, MS PowerPoint, MS Excel, E-Learning, Cyber-Wellness P3 Chinese Painting"
TAO NAN SCHOOL,http://www.taonan.moe.edu.sg,49 MARINE CRESCENT,449761,64428307,na,64435973,na,taonan_sch@moe.edu.sg,Paya Lebar,"13, 16, 31, 36, 43, 48, 55, 196, 197",DR CHIN KIM WOON,MRS GOH PEY SAN,MR LEOW YEN MIN,MR NG CHU SIU,na,na,Love to Learn and Learn to Love.,To nurture innovative pupils of exemplary character with a love for learning.,na,MARINE PARADE,EAST,EAST 7,GOVERNMENT-AIDED SCH,CO-ED SCHOOL,DOUBLE SESSION,PRIMARY,Yes,No,Yes,No,Chinese,na,na,Gifted Education Prog BICEP Prog P1 - P5 AWorld! P2 & P3 Angklung P3 Swimming P3 & P4 Wushu P5 Character Development Camp P5 China Exchange Programme
NANYANG PRIMARY SCHOOL,http://www.nyps.moe.edu.sg,52 KING'S ROAD,268097,64672677,na,64686913,na,NYPS@MOE.EDU.SG,Farrer Rd MRT Station,"66, 67, 74, 93, 151, 153, 154, 156, 157, 165, 170, 171, 174, 186, 852, 855, 961",MDM LER JIA LUEN,MDM NG BOON IN,MR CHAN CHEONG CHEONG,MR LEE KO YONG,na,na,"Learners of Character, Leaders in Action","Developing our pupils to reach their fullest potential within a bicultural environment that is steeped in diligence, prudence, respectability and simplicity, thereby enabling them to contribute to society.",na,BUKIT TIMAH,WEST,WEST 5,GOVERNMENT-AIDED SCH,CO-ED SCHOOL,SINGLE SESSION,PRIMARY,Yes,No,Yes,No,Chinese,na,na,Chinese Enrichment Chinese Speech and Drama English Enrichment Violin Ensemble Maths Olympiad(Pr 4 to Pr 6) Special Art Course
ST. ANTHONY'S PRIMARY SCHOOL,http://www.stanthonyspri.moe.edu.sg,30 BUKIT BATOK ST 32,659401,65690822,na,65690811,na,SAPS@MOE.EDU.SG,Bukit Gombak MRT Station,945,MISS CECILIA LIM SEOK CHENG,MR ANDY MICKEY CHOONG TEK CHOY,MR CHAN KEN YAN MICHAEL,na,na,na,"Caring Hearts, Passionate Learners; Lasallians in service of God, family and nation","Enabling our children to learn how to learn and to learn how to live, to become persons of integrity and persons for others in God's service",na,BUKIT BATOK,WEST,WEST 2,GOVERNMENT-AIDED SCH,CO-ED SCHOOL,SINGLE SESSION,PRIMARY,No,No,No,No,Chinese,Malay,Tamil,"School Integrated Programme, Care Quest, Buddy Reading, KidsREAD, P5 Adventure Camp, Swimming programme for P3, OLE (Overseas Learning Experiences)"
MAHA BODHI SCHOOL,http://www.mahabodhi.moe.edu.sg/,10 UBI AVENUE 1,408931,67442115,na,67443752,na,MBS@MOE.EDU.SG,"Eunos Station (Transfer Bus No.63, 63M)","8,15,22,25,51,55,61,63,63M,65,66,93,94,854",MRS ELAINE QUEK-LIM HWEE BIN,MR LIM KIM MIN (LIN JINMIN),MRS ESTHER LEE,MDM LENG BING LING (LIANG BINGLING),na,na,Inspired learners of exemplary character,"To develop the potential of every child to the fullest and nurture them to be concerned citizens, morally upright and rooted in Chinese Culture",na,GEYLANG,EAST,EAST 7,GOVERNMENT-AIDED SCH,CO-ED SCHOOL,DOUBLE SESSION,PRIMARY,Yes,No,No,No,Chinese,na,na,"Special Assistance Plan P2 & P3 Maths Experiential Learning P1 - P3 Maths Champ, Whiz and Prof badges P3 - P5 MBS Sci Cards P1 - P6: Stories-Based Writing P1 - P5 IT Skills Programme Overseas Exchange Programmes with schs in Nanjing & Taiwan"
PEI CHUN PUBLIC SCHOOL,http://www.peichunpublic.moe.edu.sg,580 TOA PAYOH EAST,319133,63539450,na,63538418,na,PCPS@MOE.EDU.SG,Toa Payoh Station and Braddell Station,"Bus Service 232, 57",MR LIM MENG WEI,MS ANGELA GOH BEE LIAN,MISS LEONG QINGHUA,MDM TAN HUI LING,na,na,Passionate and Cultured Learners Proactive and Caring Leaders,Provide a holistic education to nurture responsible citizens and enhance bilingualism to maximize potential,na,TOA PAYOH,SOUTH,SOUTH 3,GOVERNMENT-AIDED SCH,CO-ED SCHOOL,DOUBLE SESSION,PRIMARY,Yes,No,No,No,Chinese,na,na,Special PE for identified Primary 2 pupils. Primary 3 to 6 Sports Classes. Character-First Programme.
POI CHING SCHOOL,http://www.poiching.moe.edu.sg,21 TAMPINES STREET 71,529067,67856420,na,67857198,na,contact@poiching.moe.edu.sg,Tampines MRT,"Bus 293, 72, 27 and 168",MR MAH SENG THONG ANDREW,MRS ESTHER SEE-LING SZENGEN,MDM LIM TZYY SHIUAN,MISS CHUA MEI LI,na,na,A premier SAP school,To nurture morally upright and effectively bilingual citizens,na,TAMPINES,EAST,EAST 1,GOVERNMENT-AIDED SCH,CO-ED SCHOOL,SINGLE SESSION,PRIMARY,Yes,No,No,No,Chinese,na,na,1) SAP - School offers Mother Tongue as first language to pupils of P1 to P6. 2) Collaboration with Futsing Association in overseas exchange programme 3) Culturally rich programmes to enhance pupils' learning
