school_name,url_address,address,postal_code,telephone_no,telephone_no_2,fax_no,fax_no_2,email_address,mrt_desc,bus_desc,principal_name,first_vp_name,second_vp_name,third_vp_name,fourth_vp_name,fifth_vp_name,visionstatement_desc,missionstatement_desc,philosophy_culture_ethos,dgp_code,zone_code,cluster_code,type_code,nature_code,session_code,mainlevel_code,sap_ind,autonomous_ind,gifted_ind,ip_ind,mothertongue1_code,mothertongue2_code,mothertongue3_code,special_sdp_offered
ANDERSON SECONDARY SCHOOL,http://www.andersonsec.moe.edu.sg,10 ANG MO KIO STREET 53,569206,64598303,na,64586104,na,anderson_ss@moe.edu.sg,"ANG MO KIO MRT, YIO CHU KANG MRT","265, 548, 45, 50, 72",MDM THONG MAY TENG,MDM DOREEN TAN MUI HIANG,MDM LOW CHIA YEE,na,na,na,"A Caring Community of Thinkers, Innovators and Leaders who Inspire and Serve.","Developing and Inspiring in all Andersonians a sense of purpose, and constancy to reach their full potential for self and nation.","As a mainstream autonomous secondary school offering both the GCE 'O' and 'N' Level tracks, we provide a stimulating and vibrant environment that nurtures the whole child. By creating a quality difference in our students' development and experiences in Anderson, our students develop an inquiring and innovative mind, strong moral grounding, cultural awareness and self-efficacy to succeed in the 21st century.  This distinctive Anderson brand of quality education produces achievers with high integrity and robust character who are passionate about life, inspiring and of service to others. A 'Culture of Care and Excellence' pervades our school - we build pride in everyone through recognising success and inspiring excellence; we nurture a strong sense of belonging amongst our people through forging bonds and building community; we imbue in all our students the ANDE Values through our 3-prong approach of 'Educating the Head', 'Encouraging the Heart' and 'Empowering the Hands'. All these are made possible with our dedicated team of teachers who are highly competent, collaborative and nurturing, and supported by a strong alumni and supportive parents.",ANG MO KIO,NORTH,NORTH 3,GOVERNMENT SCHOOL,CO-ED SCHOOL,SINGLE SESSION,SECONDARY,No,Yes,No,No,Chinese,Malay,Tamil,"With the aim to nurture Andersonians to be intellectually curious, innovative, creative and culturally versatile leaders, the school takes pride in its niche and signature programmes that provide the platforms to imbue these qualities and facilitate diverse learning experiences. We have established a comprehensive Science Research Programme that provides opportunities for students to pursue their interests, develop their competencies and hone their talents in this area.  The Drama Programme seeks to develop students into confident communicators and reflective thinkers who are able to challenge common perceptions and stereotypical perspectives. The Malay Elective Programme in Malay Language for Secondary Schools (EMAS) provides opportunities for students to develop a deeper appreciation of the Malay Language and culture. The Cultural Flexibility Programme seeks to develop students who are culturally astute, attuned to the socio-political and economic pulse of the region, yet committed to Singapore. At the same time, the Service and Student Leadership Programme integrates leadership development with community outreach and action, so that students imbibe the qualities and attitudes of a servant leader. In this way, we hope to nurture citizens who are socially aware, informed about local and international issues, and able and ready to make a difference to the community and people around them. The annual Anderson Sabbatical provides opportunities for students from all levels to step out of their comfort zone to challenge themselves by building resilience, working in teams, and developing initiative and self-reliance. All in all, there is a strong focus on experiential learning in our academic and non-academic curriculum as we seek to actively engage our students in constructing, integrating and deepening their learning experiences."
BARTLEY SECONDARY SCHOOL,http://www.bartleysec.moe.edu.sg,10 JALAN BUNGA RAMPAI,538403,62889013,na,62805595,na,bartley_ss@moe.edu.sg,BARTLEY MRT,"22, 24, 28, 43, 58, 62, 70, 70M, 76, 80, 80A, 93, 158",MR MOHD AZHAR B TERIMO,MRS TAN CHYE NA,MDM LAEU SIEW FUNG,na,na,na,"Leaders for Others, Learners for Life","Empowering every Bartleyan to lead with wisdom, serve with humility and learn with passion.","The school believes that every student has the potential to be developed and that they can and will learn and succeed. Hence, the school provides academic rigour and a robust character development programme that is grounded on our school values (Courage, Optimism, Respect, Excellence), and the principles of the 7 Habits of Highly Effective Youths (7 HEY). This will ensure that Bartleyans graduate with a distinctive character and the skills to navigate the intricacies of life successfully.",TOA PAYOH,SOUTH,SOUTH 6,GOVERNMENT SCHOOL,CO-ED SCHOOL,SINGLE SESSION,SECONDARY,No,No,No,No,Chinese,Malay,Tamil,"The school's Learning for Life Programme (LLP) is on Community Youth Leadership. As part of the LLP, all Bartleyans undergo the Student Leadership Development Programme, coupled with Outdoor Experiential Learning, to nurture them to be courageous, optimistic and responsible leaders of self and for others. The 7 Habits of Highly Effective Youths (7 HEY) programme underpins the school's character development effort. Through this programme, students learn to live out the school's motto of Facta Non Verba (Deeds not Words).   The school's Applied Learning Programme (ALP) is Chemical and Life Sciences (Perfumery). Bartley is the first and only secondary school in Singapore to offer this programme which is an area of study that provides direct application of Science concepts into the creation of a product. It is a conglomeration of chemical, life sciences, engineering and business which excites students to explore STEM (Science, Technology, Engineering, Mathematics) as their future area of specialisation.  The school collaborates with Singapore Science Centre in running the programme.  The Bartley Scholars Programme (BSP) is targeted at higher ability students to stretch and accelerate their learning. Students are exposed to a variety of learning experiences to develop their passion for learning.   The SMILE@Bartley Programme is a mentoring programme for all our graduating students. Students are not only supported emotionally in their journey towards the national examination, but are also guided to make decisions that would have an impact on their next phase of development in institutes of higher learning."
BEATTY SECONDARY SCHOOL,http://www.beattysec.moe.edu.sg,1 TOA PAYOH NORTH,318990,62569108,na,62542284,na,BEATTY_SS@MOE.EDU.SG,"Braddell MRT, Toa Payoh MRT","28,  56,  73,  88,  93,  105,  153,  155,  159,  163,  157,  231,  232",MR LING KHOON CHOW,MR SZE GUAN KIAT,MR LIM SOON WAI,na,na,na,"A Distinguished Institution of Thinkers, Learners and Contributors",To nurture Beattyians of Character with a Sense of Purpose and Passion for Life,"Established in 1953, Beatty Secondary has nurtured many illustrious Beattyians. Its Alumni boasts of prominent members from the civil service, academia, business and the arts. Beatty Secondary believes in the unique worth of every student and aims to nurture resilient, team-spirited and morally upright individuals with a sense of purpose and passion for life. The broad-based academic and character development programmes offered at Beatty are specially tailored to ignite students' passion and interest in learning. They are also designed to develop and stretch student abilities and talents to the fullest. In all, education in Beatty Secondary seeks to nurture good thinkers and self-directed learners who will become contributing members of society. Underlying these programmes is the care the school provides for the physical, intellectual, social and emotional well-being of each of its charges. Beatty's team of committed and caring staff take pride in their innovative approaches in creating an enriching and supportive learning environment for her students.",TOA PAYOH,SOUTH,SOUTH 3,GOVERNMENT SCHOOL,CO-ED SCHOOL,SINGLE SESSION,SECONDARY,No,No,No,No,Chinese,Malay,Tamil,"In Beatty Secondary, we nurture students to be Thinkers, Learners and Contributors. The school seeks to engage its learners through a varied and effective instructional curriculum and co-curriculum to help them develop the skills and disposition to navigate through life. Beatty's Applied Learning Programme (ALP), Beattyians Think. Create. Innovate Programme provides an excellent integrated platform for students to learn 21st century competencies for eg. in Critical and Inventive Thinking, Information Literacy and Communication and to apply these in real life contexts. To develop Beattyians of Character with a sense of Purpose and Passion for life, the school makes the Character development of students a key focus. Beatty's wide-ranging co-curricular programmes include outdoor adventure camps, the Values in Action programme, cultural exchange programmes with overseas partner schools eg Japan. These programmes serve to imbibe sound values, develop strength of character and socio-emotional competencies in students. Beatty's Learning For Life Programme (LLP), Leaders for Life Programme nurtures every Beattyian with leadership skills and disposition through a structured system of training, mentoring and opportunities at leading. Beatty's Key Programmes: MOE Higher Chinese Centre, Beatty Character & Citizenship Education, Overseas Twinning Programme, ICT Training Programme, Drama-in-curriculum, Subject-based Talent Development Programme, Elective & Advanced Elective Modules, Life Science Programme, Environmental Education."
CEDAR GIRLS' SECONDARY SCHOOL,http://www.cedargirlssec.moe.edu.sg,1 CEDAR AVENUE,349692,62884909,na,62820244,na,cedargirlss@moe.edu.sg,"WOODLEIGH MRT, POTONG PASIR MRT","8, 61, 64, 65, 66, 90, 100, 135, 151, 154, 155",MDM CHENG HWEE YEANG,MISS SIM SOO LENG AILEEN,MDM JUSTINE TAN,na,na,na,"Bringing out the Best in our People: Social Innovators, Passionate Learners",Nurturing Leaders of Character,"With the belief that every Cedarian can become a confident and active citizen, Cedar Girls is committed to providing a high quality all-round education. Beside a well-established 4-year O-Level programme, Cedar Girls also offers the Integrated Programme (IP) under the Victoria-Cedar Alliance (VCA). Our IP students will complete 4 years of secondary education in Cedar Girls before advancing to Victoria Junior College for the A-level curriculum. The VCA IP offers a seamless 6-year programme to students who enjoy independent study and exploratory work. They will have the opportunities to heighten their interest and passion through a challenging and enriched curriculum. In our mission to develop Leaders of Character, we have a comprehensive Character, Citizenship and Leadership Development Programme which inculcates the values, attributes and competencies desired of Cedarians in their journey through life. Cedar Girls has received recognition in both the academic and co-curricular domains for its consistent performance and good teaching and learning processes. Graduating students each year have attributed their resilience to take on challenges, confidence in striking out and motivation to always give of their best to the developmental programmes offered by the school.",TOA PAYOH,EAST,EAST 7,GOVERNMENT SCHOOL,GIRLS' SCHOOL,SINGLE SESSION,SECONDARY,No,Yes,No,Yes,Chinese,Malay,Tamil,"Through the Leaders of Character Programme, all Cedarians are given opportunities to put their values into action via student-initiated community projects so as to nurture and develop them into leaders of character. The Social Innovation Programme is the school's signature programme which aims to nurture Cedarians into social innovators. Through this programme, students' innovative capacity is developed and honed to provide them with the vital skills they need to create breakthrough solutions to address authentic issues faced by the community. With the aim to broaden Cedarians' perspectives, the Beyond Borders Programme provides Cedarians the opportunity to explore learning beyond the shores of Singapore, see the world differently and learn to work collaboratively with local and international partners. Cedarians with special talents are given the opportunity to pursue their passions and interests through the Talent Development Programme. This programme aims to stimulate the students intellectually and cognitively to create new knowledge and stretch their potential. We also have a Sports Class which is tailored to the learning needs of our sports talents. To help these students balance their achievements in sports and the academic domain, our team of teachers and coaches work together synergistically to plan and strategize their learning and training needs."
CRESCENT GIRLS' SCHOOL,http://www.crescent.edu.sg/,357 TANGLIN ROAD,247961,64758711,na,64741248,na,CRESCENTGIRL@MOE.EDU.SG,REDHILL MRT,"32, 111, 122, 132, 51, 139, 186, 970",MRS HELEN CHONG,MDM V PRIYA RAJAN,MISS LOW SHIOK CHENG CINDY,MISS CHUANG SIEW CHIN,na,na,Our vision is to be a premier school with a nurturing and innovative environment that prepares students to be ladies and leaders of tomorrow.,"Our mission is to develop and inspire in each Crescentian a sense of her own potential as ""An excellent and well-balanced scholar"", ""A disciplined, responsible member of society"", and ""A caring, gracious citizen of the world"".","Crescent Girls' School provides a nurturing and innovative environment with a distinctive brand of education that empowers generations of students to grow into gracious, confident ladies and caring visionary leaders. The school focuses on transforming the learning experiences of students through pervasive and purposeful use of technology. As one of the pioneer FutureSchools@Singapore, we continually harness technology to develop a passion for learning and for life in our students so that they are well-prepared for the challenges of the 21st century. Beyond academic excellence, the school is committed to inculcate sound values in our students to be able to contribute to the community. There is a pervasive culture of care in the school, and a strong emphasis on development of strength of character, a mindset of excellence, and commitment to teamwork to nurture our students to be responsible members of society and gracious citizens of the world. The school has done well in many aspects over the years. This is possible due to a team of dedicated and innovative staff and the support of parents, alumnae and the school advisory committee.",BUKIT MERAH,SOUTH,SOUTH 2,GOVERNMENT SCHOOL,GIRLS' SCHOOL,SINGLE SESSION,SECONDARY,No,Yes,No,No,Chinese,Malay,Tamil,"The school's Student Development Programmes are offered within our Student-centric Holistic Curriculum. In our Instructional Programmes, students are exposed to a myriad of learner-centric teaching approaches that extend learning beyond the classroom and empower our students with 21st century competencies like collaboration, global awareness, skilled communication and real-world problem solving. Our 4-year Character & Leadership Development Programme provides all students with opportunities to develop their leadership potential. Our Values-In-Action Programme equips students with problem solving skills and provides platforms to engage with the community, with the aim of inspiring and empowering our students to make a difference in society. All students have opportunities to travel overseas in our Internationalisation Programme, which aims to develop a sense of empathy, civic responsibility and cross-cultural skills in our students. Our Talent Development Programme aims to stretch our able, committed and creative students further. The school also offers the Music Elective Programme for students passionate about music."
GAN ENG SENG SCHOOL,http://www.ganengsengsch.moe.edu.sg/,1 HENDERSON ROAD,159561,64745594,na,64732479,na,GESS@MOE.EDU.SG,"REDHILL MRT, TIONG BAHRU MRT","14,16,32,33,51,63,64,120,122,145,139,186,851,970",MDM TAN MEI MEI JENNY,MR LEE KAH WAI,MR CHUNG KWOK LEONG DANIEL,na,na,na,"Gessians of Excellence, Standing and Significance.",Our school is a community that nurtures the best in each and strives ever ONWARD.,"The school strongly believes in providing a Quality Student Experience provided by a Quality School Team, which is committed to building quality relationships with our Partners. It believes that education in the 21st century is about nurturing the whole person, in which his/ her actions are guided by the school mission of nurturing the best in each to strive ever ONWARD. The school nurtures an environment where every student and staff member is valued, encouraged and empowered to excel, learn and care for others, and where their accomplishments are celebrated. The school designs a wide range of academic and student development programmes to provide students with both formal and informal learning opportunities. Through its distinctive programmes, the school builds students' confidence, nurtures in them 21st century competencies, and prepares them for the future. The school's CCE curriculum engages the students' heads, hearts and hands; every student will go through programmes such as level camps, community and youth leadership events and overseas expeditions that focus on developing self-mastery skills and contributing to the community.",BUKIT MERAH,SOUTH,SOUTH 4,GOVERNMENT SCHOOL,CO-ED SCHOOL,SINGLE SESSION,SECONDARY,No,No,No,No,Chinese,Malay,Tamil,"The GESS LIFE programme seeks to develop students to be confident and effective student leaders who positively impact their community through the 3D approach - Discovering myself, Developing good habits, and Designing our world. Students discover themselves and develop a better appreciation of one another's uniqueness using the Myers-Briggs Type Indicator assessment. They will learn effective strategies to leverage their strengths and build competencies in other areas, and collaborate with others. The LIFE programme will provide school-wide, cohort and personal opportunities for every student to purposefully apply their knowledge and skills to impact their school and community. The GESS Applied Learning Programme, GESS Probes*, serves to prepare students for their future workplace. It aims to develop future workskills 2020 such as transdisciplinarity, design thinking, and novel and adaptive thinking in students. The programme focuses on STEAM (Science, Technology, Engineering, Aesthetics and Mathematics) as well as the design thinking process. Probes* refers to the underwater probe that students will be tasked to design as part of their learning process. There are two tiers for the programme catering to different needs of the students. The school is implementing greater flexibility in subject offering at lower secondary levels. Eligible N(A) and N(T) students can take some subjects at a higher level starting from Secondary 1, based on their PSLE results. Beyond the start of Secondary 1, students can also do so if they do well in those subjects."
QUEENSWAY SECONDARY SCHOOL,http://www.queenswaysec.moe.edu.sg,2A MARGARET DRIVE,149295,64741421,na,64741302,na,QSS@moe.edu.sg,"COMMONWEALTH MRT, QUEENSTOWN MRT","32,51,93,100,105,111,122,123,145,147,153,186,195,196,198,855,961,970",MR LUI SENG CHEONG,MDM LOK YIN YIN,MISS PAULINE CHIA HUI MIEN,MR YONG WEI LEONG,na,na,Caring Citizens and Life-long Learners in a School of Excellence,"Providing a holistic education to nurture caring, responsible citizens and confident, life-long learners in a changing world","We believe that every child is unique, valuable and can achieve success. Every staff makes a difference as we develop students according to their abilities. We inculcate values, good habits and 21st century skills to nurture lifelong learners and caring citizens and work with key stakeholders to build a learning community.",QUEENSTOWN,SOUTH,SOUTH 2,GOVERNMENT SCHOOL,CO-ED SCHOOL,SINGLE SESSION,SECONDARY,No,No,No,No,Chinese,Malay,Tamil,"The QSS Experience provides varied programmes and opportunities to nurture every Queenswayan to become a caring, responsible citizen and confident, life-long learner. We harness differentiated approaches to stretch our students' cognitive ability through our academic programmes. Our customised English Ingenium Programme stretches high-ability students in the English Language. The school's Applied Learning Programme in Science, Technology, Engineering and Math (STEM) develops critical and innovative thinking through inquiry-based, experiential and co-operative learning approaches.  It is structured and integrated in our Sciences and Humanities academic curriculum. The comprehensive Character and Citizenship Education programme nurtures desired social-emotional attributes and inculcates values and life-long skills. Our extensive CCA, Student Leadership Development and Values-in-Action programmes provide varied authentic experiential learning opportunities to develop students to be caring, responsible citizens and confident, life-long learners. QSS Lifelong Learning Programme in Sports for Life & Outdoor Education inculcates interest, skills and attitudes for active, life-long participation in sports, physical and outdoor activities. Our Student Development Team structure enhances the quality of school experience with emphasis and attention to values education and students' social emotional needs and development. Students at each level are cared for and mentored by their Form Teachers, together with their Year Heads who oversee the holistic development of the students and work closely with the school management team to ensure effective delivery of student-centric, values-driven education to our students. Other special programmes include Advanced Elective & Elective Modules, ICT & Mobile Apps, Digital Art, Aesthetics & Performing Arts, Internationalisation Programme and Outdoor Education camps and modules."
RAFFLES GIRLS' SCHOOL (SECONDARY),http://www.rgs.edu.sg/,20 ANDERSON ROAD,259978,67371845,na,62353731,na,RGSS@MOE.EDU.SG,"ORCHARD MRT, STEVENS MRT","105, 132, 190, 972",MDM THAM MUN SEE,na,na,na,na,na,"To aspire, strive and dare to be active creators of a better age for all.",Nurturing the high ability girl to be a leader who will realise her talents in service of nation and community.,"At RGS, every student is nurtured and developed to her fullest potential. Our students journey beyond traditional boundaries in their pursuit of knowledge in a supportive environment that caters especially to their needs, so that they can live a fulfilling life and contribute back to society.",CENTRAL,SOUTH,SOUTH 7,INDEPENDENT SCHOOL,GIRLS' SCHOOL,SINGLE SESSION,SECONDARY,No,No,Yes,Yes,Chinese,Malay,Tamil,"Providing a holistic education, our six-year Raffles Programme (Y1-4 in RGS and Y5-6 in RI) that bypasses the GCE O Level Examinations, features an enriched and accelerated curriculum that nurtures high-ability learners. At the end of Y6, RGS girls graduate not only with the GCE A Level Examination certificate, but also with the Raffles Diploma - designed to recognise the peaks of excellence in five domains: Cognitive, Character & Leadership, Community & Citizenship, Sports & Health, and Arts & Aesthetics.   Student Development develops the personal capacity of RGS girls and nurtures them to be individuals who are conscious of their responsibility to family, community and nation. Their disposition is developed through the inculcation of knowledge, competencies and values through the Character and Leadership Education (CLE) programme. The CLE Programme empowers our girls to be: good stewards of their lives by heightening their self-awareness through reflection and equipping them with self-management and interpersonal skills; active and socially responsible citizens by promoting school and community involvement; reflective and visionary leaders by equipping them with a habit for introspection, decision-making with foresight and a spirit of teamwork.   Special programmes offered include: Third Languages (Arabic, French, German, Japanese, Spanish, Chinese/Malay Special Programmes); Music Elective Programme; Special Art Programme; Regional Studies Programme; Research Studies Programme (featuring Odyssey of the Mind and Future Problem Solving Programme - Community Problem Solving Programme); Raffles Academy (Literature, History, Geography, Mathematics, Chemistry, Biology, Physics, Higher Chinese Language) catering to girls with special talents; Mentorship Programmes in Science, Mathematics, Humanities and Creative Writing; Language Immersion Programme; Values-in-Action Programme; Student Leadership Development Programme; Work Experience Programme."
